term	name	description	score	pvalue	FDR	cluster	enriched	geneIDs
GO:0008236	serine-type peptidase activity	Catalysis of the hydrolysis of peptide bonds in a polypeptide chain by a catalytic mechanism that involves a catalytic triad consisting of a serine nucleophile that is activated by a proton relay involving an acidic residue (e.g. aspartate or glutamate) and a basic residue (usually histidine).	0.033333333	0.605347403	0.699687258	30	1/128	XC_2972
GO:0055085	transmembrane transport	"The process in which a solute is transported across a lipid bilayer, from one side of a membrane to the other."	0.043478261	0.651977357	0.743922882	46	2/127	XC_2707; XC_2708
GO:0071705	nitrogen compound transport	"The directed movement of nitrogen-containing compounds into, out of or within a cell, or between cells, by means of some agent such as a transporter or pore."	0.0125	0.733126789	0.825927648	80	1/128	XC_2297
GO:0008652	cellular amino acid biosynthetic process	"The chemical reactions and pathways resulting in the formation of amino acids, organic acids containing one or more amino substituents."	0.037037037	0.737567319	0.820543643	81	3/126	XC_0194; XC_1768; XC_1770
GO:0070011	"peptidase activity, acting on L-amino acid peptides"	Catalysis of the hydrolysis of peptide bonds formed between L-amino acids.	0.019417476	0.77033702	0.846419688	103	2/127	XC_3873; XC_2972
GO:0008233	peptidase activity	Catalysis of the hydrolysis of a peptide bond. A peptide bond is a covalent bond formed when the carbon atom from the carboxyl group of one amino acid shares electrons with the nitrogen atom from the amino group of a second amino acid.	0.019230769	0.770612348	0.836396328	104	2/127	XC_3873; XC_2972
GO:0006520	cellular amino acid metabolic process	"The chemical reactions and pathways involving amino acids, carboxylic acids containing one or more amino groups, as carried out by individual cells."	0.021126761	0.800591035	0.858465085	142	3/126	XC_0194; XC_1768; XC_1770
GO:0046872	metal ion binding	Interacting selectively and non-covalently with any metal ion.	0.020979021	0.80102399	0.84870399	143	3/126	XC_3531; XC_3873; XC_3532
GO:0006807	nitrogen compound metabolic process	The chemical reactions and pathways involving organic or inorganic compounds that contain nitrogen.	0.028402367	0.822700086	0.861415385	845	24/105	XC_0001; XC_0198; XC_0194; XC_1061; XC_2253; XC_2333; XC_2281; XC_2506; XC_0486; XC_3272; XC_4031; XC_1419; XC_3528; XC_0812; XC_0648; XC_1295; XC_3997; XC_1311; XC_2251; XC_3957; XC_0195; XC_3897; XC_1768; XC_1770
GO:0005975	carbohydrate metabolic process	"The chemical reactions and pathways involving carbohydrates, any of a group of organic compounds based of the general formula Cx(H2O)y. Includes the formation of carbohydrate derivatives by the addition of a carbohydrate residue to another molecule."	0.020408163	1	1.017142857	98	2/127	XC_0626; XC_1005
GO:0008152	metabolic process	"The chemical reactions and pathways, including anabolism and catabolism, by which living organisms transform chemical substances. Metabolic processes typically transform small molecules, but also include macromolecular processes such as DNA repair and replication, and protein synthesis and degradation."	0.030482642	1	1.017142857	1181	36/93	XC_0001; XC_0198; XC_0194; XC_1061; XC_2253; XC_2333; XC_2281; XC_2506; XC_0486; XC_3272; XC_4031; XC_1419; XC_3528; XC_0812; XC_0648; XC_1295; XC_3997; XC_1311; XC_2251; XC_3957; XC_0195; XC_2855; XC_3897; XC_1793; XC_1885; XC_3762; XC_1454; XC_1300; XC_1884; XC_3763; XC_1455; XC_1301; XC_0626; XC_1005; XC_1768; XC_1770
GO:0051536	iron-sulfur cluster binding	"Interacting selectively and non-covalently with an iron-sulfur cluster, a combination of iron and sulfur atoms."	0.019607843	1	1.017142857	51	1/128	XC_1792
GO:0016798	"hydrolase activity, acting on glycosyl bonds"	Catalysis of the hydrolysis of any glycosyl bond.	0.028571429	1	1.017142857	70	2/127	XC_0626; XC_1005
